{
  "$schema": "https://json-schema.org/draft/2020-12/schema",
  "$id": "https://github.com/grokify/structured-plan/schema/v2mom.schema.json",
  "$ref": "#/$defs/V2MOM",
  "$defs": {
    "Measure": {
      "properties": {
        "id": {
          "type": "string"
        },
        "name": {
          "type": "string"
        },
        "description": {
          "type": "string"
        },
        "baseline": {
          "type": "string"
        },
        "target": {
          "type": "string"
        },
        "current": {
          "type": "string"
        },
        "unit": {
          "type": "string"
        },
        "progress": {
          "type": "number"
        },
        "timeline": {
          "type": "string"
        },
        "status": {
          "type": "string"
        }
      },
      "additionalProperties": false,
      "type": "object"
    },
    "Metadata": {
      "properties": {
        "id": {
          "type": "string"
        },
        "name": {
          "type": "string"
        },
        "author": {
          "type": "string"
        },
        "team": {
          "type": "string"
        },
        "fiscalYear": {
          "type": "string"
        },
        "quarter": {
          "type": "string"
        },
        "version": {
          "type": "string"
        },
        "status": {
          "type": "string"
        },
        "createdAt": {
          "type": "string",
          "format": "date-time"
        },
        "updatedAt": {
          "type": "string",
          "format": "date-time"
        },
        "parentId": {
          "type": "string"
        },
        "structure": {
          "type": "string"
        },
        "terminology": {
          "type": "string"
        }
      },
      "additionalProperties": false,
      "type": "object"
    },
    "Method": {
      "properties": {
        "id": {
          "type": "string"
        },
        "name": {
          "type": "string"
        },
        "description": {
          "type": "string"
        },
        "priority": {
          "type": "string"
        },
        "status": {
          "type": "string"
        },
        "owner": {
          "type": "string"
        },
        "startDate": {
          "type": "string"
        },
        "endDate": {
          "type": "string"
        },
        "measures": {
          "items": {
            "$ref": "#/$defs/Measure"
          },
          "type": "array"
        },
        "obstacles": {
          "items": {
            "$ref": "#/$defs/Obstacle"
          },
          "type": "array"
        },
        "projects": {
          "items": {
            "type": "string"
          },
          "type": "array"
        }
      },
      "additionalProperties": false,
      "type": "object"
    },
    "Obstacle": {
      "properties": {
        "id": {
          "type": "string"
        },
        "name": {
          "type": "string"
        },
        "description": {
          "type": "string"
        },
        "severity": {
          "type": "string"
        },
        "likelihood": {
          "type": "string"
        },
        "mitigation": {
          "type": "string"
        },
        "status": {
          "type": "string"
        }
      },
      "additionalProperties": false,
      "type": "object"
    },
    "Project": {
      "properties": {
        "id": {
          "type": "string"
        },
        "name": {
          "type": "string"
        },
        "description": {
          "type": "string"
        },
        "category": {
          "type": "string"
        },
        "methodId": {
          "type": "string"
        },
        "priority": {
          "type": "string"
        },
        "status": {
          "type": "string"
        },
        "startDate": {
          "type": "string"
        },
        "endDate": {
          "type": "string"
        },
        "quarter": {
          "type": "string"
        },
        "dependencies": {
          "items": {
            "type": "string"
          },
          "type": "array"
        },
        "externalLinks": {
          "additionalProperties": {
            "type": "string"
          },
          "type": "object"
        }
      },
      "additionalProperties": false,
      "type": "object"
    },
    "V2MOM": {
      "properties": {
        "$schema": {
          "type": "string"
        },
        "metadata": {
          "$ref": "#/$defs/Metadata"
        },
        "vision": {
          "type": "string"
        },
        "values": {
          "items": {
            "$ref": "#/$defs/Value"
          },
          "type": "array"
        },
        "methods": {
          "items": {
            "$ref": "#/$defs/Method"
          },
          "type": "array"
        },
        "obstacles": {
          "items": {
            "$ref": "#/$defs/Obstacle"
          },
          "type": "array"
        },
        "measures": {
          "items": {
            "$ref": "#/$defs/Measure"
          },
          "type": "array"
        },
        "projects": {
          "items": {
            "$ref": "#/$defs/Project"
          },
          "type": "array"
        }
      },
      "additionalProperties": false,
      "type": "object"
    },
    "Value": {
      "properties": {
        "name": {
          "type": "string"
        },
        "description": {
          "type": "string"
        },
        "priority": {
          "type": "integer"
        }
      },
      "additionalProperties": false,
      "type": "object"
    }
  },
  "title": "V2MOM Document",
  "description": "Schema for V2MOM (Vision, Values, Methods, Obstacles, Measures) documents"
}